{
  "summary": "Workspace, Session and shell rows.",
  "states": [
    "open",
    "archived{reason}"
  ],
  "transitions": [
    "explicit_close",
    "shell_exited",
    "spawn_failed",
    "pi_spawn_failed",
    "missing_open_pane",
    "resume → open"
  ],
  "anchors": [
    "crates/axo-server/src/session.rs#archive_session",
    "crates/axo-server/src/session.rs#archive_shell"
  ]
}
