{
  "summary": "A pane is available, or unavailable with a non-empty reason; the wire form enforces the pairing.",
  "states": [
    "available",
    "unavailable{reason}"
  ],
  "transitions": [
    "Pi exit → unavailable",
    "recovery commit → available"
  ],
  "anchors": [
    "crates/axo-protocol/src/model.rs#Availability"
  ]
}
